comment_id,video_id,text,Label,Score
UghF9pk71Auy33gCoAEC,3JZ_D3ELwOQ,The meth-head will also have the squirrel trying to bury his nuts in him all damn day long too.,NEGATIVE,0.9958937168121338
Uggy-UbBH-xWrXgCoAEC,3JZ_D3ELwOQ,Dont stop!!,POSITIVE,0.963034451007843
UgheGhOeOqtmpngCoAEC,3JZ_D3ELwOQ,I HOPE RAY DOSN&#39;T STOP EQUALS 3,POSITIVE,0.8745617866516113
Ugjw8X1qNJNe-ngCoAEC,3JZ_D3ELwOQ,I&#39;ll come back when the beard goes.,NEGATIVE,0.9539999961853027
Ugh99OOlE013tXgCoAEC,3JZ_D3ELwOQ,Funniest episode so far!! :) ,POSITIVE,0.9998123049736023
UghpTPLlj9bxengCoAEC,3JZ_D3ELwOQ,ok I am in Australia but I have never seen a Kangaroo that size lol,POSITIVE,0.9934772253036499
UggeaKQSCN44GXgCoAEC,3JZ_D3ELwOQ,One of the best episodes you&#39;ve uploaded!,POSITIVE,0.9997604489326477
UghpqnZjAPGEcHgCoAEC,3JZ_D3ELwOQ,The Kangaroo is like &quot;I. Am. YOKED!!!!&quot;.,NEGATIVE,0.9967678785324097
Ugh8j8d_r1YfuXgCoAEC,3JZ_D3ELwOQ,"Not koala bears, drop bears<br>",NEGATIVE,0.9884741902351379
Ugje4aPw_SzdpXgCoAEC,3JZ_D3ELwOQ,One of your best in a while ,POSITIVE,0.9998536109924316
Ughsyte_1S9T3ngCoAEC,3JZ_D3ELwOQ,Kangaroo jack much,POSITIVE,0.8733271956443787
UgjAQIIBhbPV6XgCoAEC,3JZ_D3ELwOQ,In Australia this is so obvious to find,NEGATIVE,0.9962453246116638
UgieEBDpA20ymXgCoAEC,3JZ_D3ELwOQ,"I would just like to say that my husband loved you show, he just passed away yesterday and I just finished watching this episode and you put a smile on my face, thank you ray",POSITIVE,0.9997779726982117
UgjKsLtwA3gBCXgCoAEC,3JZ_D3ELwOQ,Koalas aren&#39;t a bear. They fuck you up for saying that,NEGATIVE,0.98816978931427
Ugg7wxonTN8yxHgCoAEC,3JZ_D3ELwOQ,That kangaroo is my pet,NEGATIVE,0.6490091681480408
UggjJaG8Aw0f53gCoAEC,3JZ_D3ELwOQ,my main problem with the cop is that he took both hands off the wheel while in a high speed chase,NEGATIVE,0.9992595314979553
UgifS0Q_FrB33HgCoAEC,3JZ_D3ELwOQ,More rewind,NEGATIVE,0.9992972612380981
UgjezGPpngxSpngCoAEC,3JZ_D3ELwOQ,Ray why aren&#39;t ya on youtube rewind ?,NEGATIVE,0.9990066885948181
UghTaMGyKAGu33gCoAEC,3JZ_D3ELwOQ,Koala... Bear? No no Ray. No bear. ,NEGATIVE,0.9964602589607239
UgjkT4A8A9pAxngCoAEC,3JZ_D3ELwOQ,This is your 666th vid!,POSITIVE,0.9617199301719666
UgjgdQ3Qx6x3kXgCoAEC,3JZ_D3ELwOQ,"nice video, ray",POSITIVE,0.9998300075531006
UghUbSPm0mN_GXgCoAEC,3JZ_D3ELwOQ,I think the cop was to harsh,NEGATIVE,0.992141842842102
UgixPOCBkbTgzXgCoAEC,3JZ_D3ELwOQ,them biceps tho,POSITIVE,0.9266781210899353
UggAQjJ6KoaCY3gCoAEC,3JZ_D3ELwOQ,The last video makes me think of a video that could be made for a rooster teeth immersion of a fps game,NEGATIVE,0.9957204461097717
UghQ2TOUIwZo_3gCoAEC,3JZ_D3ELwOQ," I just uploaded Romantic Valentine&#39;s Day Look on my channel that&#39;s perfect if you&#39;re going out for those restaurants with dim yellow lightings. It would mean the world to me if you check it out. You don&#39;t have to subscribe to me, all I want is for people to give me a chance. Thank you for your time :)",POSITIVE,0.9983394145965576
UggHa4jNJhoC83gCoAEC,3JZ_D3ELwOQ,"Fuck, honestly I&#39;m going to Miss watching ur videos the day u quit making them Ray! I&#39;ve been subscribed to u for 4 years! Good memories n many laughs old chap ",NEGATIVE,0.986549437046051
UgjScp8aDA2d0XgCoAEC,3JZ_D3ELwOQ,Ray is going through his coked out Scorsese phase.,NEGATIVE,0.9686429500579834
UghL-jyPrs9Xz3gCoAEC,3JZ_D3ELwOQ,Damn this kangaroo is jacked all puns aside,NEGATIVE,0.9986849427223206
Ugg6kfHIUtIZnngCoAEC,3JZ_D3ELwOQ,is he kangaroo jacked,NEGATIVE,0.9977843165397644
UgjlteDjuCTYyXgCoAEC,3JZ_D3ELwOQ,I think the kangaroo is what a male kangaskhan would look like,POSITIVE,0.7856923937797546
UggzpV2Ywq1EgXgCoAEC,3JZ_D3ELwOQ,boss ass roo,NEGATIVE,0.9836387634277344
Ugihq7j4ZzuGPngCoAEC,3JZ_D3ELwOQ,Is this kangaroo a furry,NEGATIVE,0.5957990884780884
UghSrh_n2bnXB3gCoAEC,3JZ_D3ELwOQ,Only female kangarooes have pouches ,NEGATIVE,0.7282657027244568
UghHzWAA6T-0M3gCoAEC,3JZ_D3ELwOQ,"I totally thought you were gonna say he&#39;s jacked, maybe kangaroo jacked? Anybody? Lol. I was sad when you didn&#39;t.",NEGATIVE,0.9985207915306091
UggqhVqOmw1qCXgCoAEC,3JZ_D3ELwOQ,Love you Ray!,POSITIVE,0.9998708963394165
UgjANE7nu0tVrHgCoAEC,3JZ_D3ELwOQ,Billy christal is on the corner if u need any ,NEGATIVE,0.5677183270454407
UghcOf6U_u7TongCoAEC,3JZ_D3ELwOQ,"<a href=""http://ifunny.mobi/i/Xwu9P60k1"">http://ifunny.mobi/i/Xwu9P60k1</a>",NEGATIVE,0.9970417618751526
UgiGNpepUUwUm3gCoAEC,3JZ_D3ELwOQ,"<a href=""http://ifunny.mobi/i/Xwu9P60k1"">http://ifunny.mobi/i/Xwu9P60k1</a>",NEGATIVE,0.9970417618751526
UgiaINwzLwSVSXgCoAEC,3JZ_D3ELwOQ,"the third one looks like the joker was the camera man, especially at the end.",NEGATIVE,0.9940493106842041
UghRCFVU6YY1CngCoAEC,3JZ_D3ELwOQ,His 666th video<br><br>0_0,NEGATIVE,0.9190601706504822
UggX8UfABIC_zHgCoAEC,3JZ_D3ELwOQ,Ray that dog is called a Bernese Mountain Dog probably one of the most friendly dogs by breed you can have.,POSITIVE,0.9979526996612549
Ugj6L7OOUUjMT3gCoAEC,3JZ_D3ELwOQ,Dose biceps dow,NEGATIVE,0.9364844560623169
UgiRrJ_JgF1BxHgCoAEC,3JZ_D3ELwOQ,&quot;do you even fuck bro?&quot;,NEGATIVE,0.9938812255859375
Ugi4hBdWH6eqyHgCoAEC,3JZ_D3ELwOQ,where is the comment question of the day!!!!!!,NEGATIVE,0.9746497869491577
Ughv1UyXfkQNpngCoAEC,3JZ_D3ELwOQ,669 vids XD,NEGATIVE,0.9446238279342651
UggJjz5R4uubhXgCoAEC,3JZ_D3ELwOQ,<br>Kangaroo Jack anyone?,NEGATIVE,0.9954593777656555
Ugjvymv5mpfLaXgCoAEC,3JZ_D3ELwOQ,Hahaha do you even fuck bro?,NEGATIVE,0.9960476756095886
UggvdTEDfY960XgCoAEC,3JZ_D3ELwOQ,I hate that this show is ending :( but I love the podcasts! ,POSITIVE,0.9981082677841187
Ugh0LZpwgbMrtXgCoAEC,3JZ_D3ELwOQ,Ray is satanic!! 666 videos! ,NEGATIVE,0.9826263189315796
UggZEgjpfrHccXgCoAEC,3JZ_D3ELwOQ,Ray is satanic!! 666 videos! ,NEGATIVE,0.9826263189315796
UgjoBVY6AOyLx3gCoAEC,3JZ_D3ELwOQ,"So what does a &quot;First Associate Chief of Exorcisms&quot; actually do? It sounds like &quot;Big Bob&quot; must have some tough days at the office... LOL! <a href=""https://www.youtube.com/watch?v=3JZ_D3ELwOQ&amp;t=216"">3:36</a> ",NEGATIVE,0.9989983439445496
Uggr_T0jKWWc8HgCoAEC,3JZ_D3ELwOQ,"a friend showed me the kangaroo video on Saturday and I told her, she should follow you! :)",POSITIVE,0.9815846681594849
Ugj6CiTJtH2pEHgCoAEC,3JZ_D3ELwOQ,I guess you could say he&#39;s Kangaroo Jacked.,NEGATIVE,0.995612382888794
Ugh8RoAylhnXcngCoAEC,3JZ_D3ELwOQ,you have 666 videos,POSITIVE,0.9580464959144592
Ugi02H8Bycz1R3gCoAEC,3JZ_D3ELwOQ,One of the funnier videos made in what I feel like is a really long time. I actually lol&#39;d to this.,POSITIVE,0.9932258725166321
UgjcSZIfnhg7-HgCoAEC,3JZ_D3ELwOQ,"<a href=""https://www.youtube.com/watch?v=3JZ_D3ELwOQ&amp;t=155"">2:35</a> next call of duty ",NEGATIVE,0.9833735227584839
Ugh5O6gF0j4CY3gCoAEC,3JZ_D3ELwOQ,He&#39;s a kangaroo on steroids XD,NEGATIVE,0.9855208992958069
UgjKMCKxp06YcXgCoAEC,3JZ_D3ELwOQ,FYI: Male kangaroo = No pouch.<br><br>The more you know :),NEGATIVE,0.9692789316177368
UghyaxIdqF6CiHgCoAEC,3JZ_D3ELwOQ,I hate this guy for always showing up on my feed. I DONT SUBSCRIBE,NEGATIVE,0.9974014759063721
UghNiBVaInYHC3gCoAEC,3JZ_D3ELwOQ,I see you´ve watched some of Vitalys videos too Ray!,NEGATIVE,0.9768335819244385
UgiE3m-fWS-C2XgCoAEC,3JZ_D3ELwOQ,Best boy electric: Darth vader?!?!?! Thats heavy dude :) greetings from Portugal :),NEGATIVE,0.9692825078964233
Ugj-ICL3e_kBS3gCoAEC,3JZ_D3ELwOQ,Ray: He&#39;s like jacked!<br><br>Me: I guess you could say he is Kangaroo Jacked up,NEGATIVE,0.9950212240219116
UghbR6IJGKMfvngCoAEC,3JZ_D3ELwOQ,1st video was funny<br>,POSITIVE,0.9959104061126709
UgiqktUNATY_X3gCoAEC,3JZ_D3ELwOQ,deffinetly a better one,POSITIVE,0.9880173206329346
UgjArIhibwHCcHgCoAEC,3JZ_D3ELwOQ,Also the unshaven beard would have been awesome for forming the classic Satan goatee and mustache. Just sayn. ,NEGATIVE,0.991647481918335
UggVjyb8-2QpLXgCoAEC,3JZ_D3ELwOQ,"Ray, as a shoutout to all of the satanists that watch your show I firmly believe that you should have dressed as Satan in your 666th video. Just sayn. ",POSITIVE,0.7402142882347107
Ugh-HNpGOkNDQ3gCoAEC,3JZ_D3ELwOQ,Lol so funny,POSITIVE,0.9998088479042053
UgjCV3hs9fMkHngCoAEC,3JZ_D3ELwOQ,I remember the sqwayull episode lol it was dead,NEGATIVE,0.9994040727615356
UghPBXoH363mGngCoAEC,3JZ_D3ELwOQ,Good vid,POSITIVE,0.999848484992981
UghKbtcIk0QmfXgCoAEC,3JZ_D3ELwOQ,I&#39;m from Arkansas finally something exciting happened here. ,POSITIVE,0.9993258714675903
UghYacKEhuyw_3gCoAEC,3JZ_D3ELwOQ,Hes kangaroo jacked,NEGATIVE,0.9919390082359314
UgjMzl1-gHjRQ3gCoAEC,3JZ_D3ELwOQ,666 videos ray<br>,POSITIVE,0.8151012659072876
UgjyFzCH_K4nUXgCoAEC,3JZ_D3ELwOQ,Do you even shave bro?,NEGATIVE,0.9941436648368835
Ugj_HJjCvIe_j3gCoAEC,3JZ_D3ELwOQ,"I love this channel but I don&#39;t know, something about him not bleeping out the curse words makes me respect Ray a little less...like he succumbed to pressure. But hey, you gotta do what you gotta do. ",POSITIVE,0.9916447997093201
UggG-CSgSry6vHgCoAEC,3JZ_D3ELwOQ,,POSITIVE,0.7481210231781006
Ugg4AW_-kZarnngCoAEC,3JZ_D3ELwOQ,kangaroo jacked,NEGATIVE,0.98643559217453
UgiBByr0W25RqHgCoAEC,3JZ_D3ELwOQ,Mooooooohhhhhhh!!! OMFG!!! I&#39;m dying !!!<br>,NEGATIVE,0.9979221224784851
Ugi4TTya1E8a9XgCoAEC,3JZ_D3ELwOQ,This was awesome.,POSITIVE,0.9998639822006226
UgjliQfeVCB1u3gCoAEC,3JZ_D3ELwOQ,This is his 666th video,POSITIVE,0.9915183186531067
UgifyMyZnxS4R3gCoAEC,3JZ_D3ELwOQ,I was just wondering how that cop was driving with that gun in his hands<br>,NEGATIVE,0.9979971051216125
Ugj9u356LLxrl3gCoAEC,3JZ_D3ELwOQ,die menschen zum lachen bringen ist super,POSITIVE,0.9099273085594177
UgjQ2jQ0kdrIO3gCoAEC,3JZ_D3ELwOQ,You know what I&#39;m going to take the high road and not make a joke about smuggling meth in fish.,NEGATIVE,0.9848006963729858
UggatyijxcZKdngCoAEC,3JZ_D3ELwOQ,I don&#39;t think we sent virgins :/,NEGATIVE,0.9970600008964539
UgimMaDxcMRkMngCoAEC,3JZ_D3ELwOQ,The guy who got pulled over May have had a mental problem.,NEGATIVE,0.9980641007423401
Ugg3f_ocLDbZ0XgCoAEC,3JZ_D3ELwOQ,whats wrong with that cop dam,NEGATIVE,0.9990039467811584
UgjgrmnKsoSvSngCoAEC,3JZ_D3ELwOQ,Best rwj ever,POSITIVE,0.9998359680175781
UgirVFoa3IvUW3gCoAEC,3JZ_D3ELwOQ,Lolz,NEGATIVE,0.9826576113700867
Ugi1BBESdjmWz3gCoAEC,3JZ_D3ELwOQ,Best boy electric: Darth Vader ,POSITIVE,0.9978812336921692
Ugh6Sm5iypzPsXgCoAEC,3JZ_D3ELwOQ,Make more if these videos,NEGATIVE,0.9746444821357727
UghFvgfsXCNfKHgCoAEC,3JZ_D3ELwOQ,Review the video of the mom dancing with her son at his wedding,POSITIVE,0.9703474640846252
UgjJZO1LIdnms3gCoAEC,3JZ_D3ELwOQ,"Wow, Ray, I&#39;ve been a long time watcher (2 1/2 years) and wow! You&#39;re channel has grown so much. You&#39;re the reason I started my channel, and you used to make me happy Thursday and Tuesday, I decided &quot;Hey, Why not come back?&quot; and I did, and fantastic memories are coming back to me. All of the great laughs, and all of the great jokes. I remember when you had &quot;Project Runaway&quot; and from that, to a Directer, WOW. Thanks Ray for all the great laughs and fantastic videos. &lt;3",POSITIVE,0.9998119473457336
Ugg14iYkvOJrFngCoAEC,3JZ_D3ELwOQ,iv done meth.. its pretty much like adhd medicine. its pretty suttle,NEGATIVE,0.9961081147193909
Ugi9DXQTKFVWyngCoAEC,3JZ_D3ELwOQ,Epic Meooow!!!,POSITIVE,0.9996331930160522
UgiRcG9JtIDN-ngCoAEC,3JZ_D3ELwOQ,that was so cute awwwwww,POSITIVE,0.9968671202659607
Ugi0r_qXi3SicHgCoAEC,3JZ_D3ELwOQ,men&#39;s asses,NEGATIVE,0.9573857188224792
UghrGoVc9GSPqHgCoAEC,3JZ_D3ELwOQ,surprised you didnt make a kangaroo jack joke lol,NEGATIVE,0.7025436162948608
UggI858WqhTIlXgCoAEC,3JZ_D3ELwOQ,666th video,POSITIVE,0.9915278553962708
Ugg9LafHimiA4HgCoAEC,3JZ_D3ELwOQ,Jacked? More like Kangaroo Jacked... Eh.... Eh..... No one? Alright,NEGATIVE,0.9955905675888062
UgjG15RPRmOl03gCoAEC,3JZ_D3ELwOQ,nice video,POSITIVE,0.9998447895050049
UggA9Qh6LlVu3ngCoAEC,3JZ_D3ELwOQ,"Craziness at <a href=""https://www.youtube.com/watch?v=3JZ_D3ELwOQ&amp;t=105"">1:45</a>",NEGATIVE,0.9952736496925354
Ugi-RWv-zpONQHgCoAEC,3JZ_D3ELwOQ,Only in Arkansas.... &lt;.&lt; ,NEGATIVE,0.9714791774749756
UgiX3v__ABKPgHgCoAEC,3JZ_D3ELwOQ,ARKANSAS GAME AND FISH!!! REP THE SOUTH,NEGATIVE,0.7058001160621643
UgjGwxAOyHgf4XgCoAEC,3JZ_D3ELwOQ,All cops with Google glass? Best idea ever.,POSITIVE,0.9912971258163452
Ugi-vK37OzBzfHgCoAEC,3JZ_D3ELwOQ,New series &quot;Kangaroo Shore&quot; GTL...,NEGATIVE,0.9905224442481995
Ugi0E4YzK4UEzHgCoAEC,3JZ_D3ELwOQ,I&#39;m sure you would have 4 cats Ray....&lt;3,POSITIVE,0.8182905316352844
Ugg9kmOLQ-ycJXgCoAEC,3JZ_D3ELwOQ,Best boy electric: Darth Vader.,POSITIVE,0.9978904128074646
UggMgoyX38QD2XgCoAEC,3JZ_D3ELwOQ,shave you look like a cave man,NEGATIVE,0.9921553730964661
Ugg_xEC8357QEngCoAEC,3JZ_D3ELwOQ,The methead looks more like Walter white but with scraggly hair,NEGATIVE,0.9949737787246704
UgjytpbJmfcoo3gCoAEC,3JZ_D3ELwOQ,I&#39;m pretty sure that that kangaroo has tumors in its arms.,NEGATIVE,0.9957315325737
Ugi0yMVhbzReo3gCoAEC,3JZ_D3ELwOQ,This is one of your funnier videos man,POSITIVE,0.999498724937439
Uggweb7ecqVrpngCoAEC,3JZ_D3ELwOQ,do you even lift brah,POSITIVE,0.9439199566841125
Ugjc1kARLvVpAXgCoAEC,3JZ_D3ELwOQ,You do look like really evil with that beard,NEGATIVE,0.9970422387123108
Ugje3uoxkLvcingCoAEC,3JZ_D3ELwOQ,The last clip the suspect was reported armed and dangerous that&#39;s why the cop responded the way he did ,NEGATIVE,0.9889768958091736
UggsAVNrp-kYPHgCoAEC,3JZ_D3ELwOQ,"I have 2 Bernese mountain dogs, and the one is exactly like the one in the video. They are both gentle giants. They are great with the family and the day-care kids that my mom babysits. They wouldn&#39;t hurt a fly.",POSITIVE,0.9997431635856628
UghzkhpuCLuSzHgCoAEC,3JZ_D3ELwOQ,the cat say&#39;s mmmooooooo it sounds like that when he did it,NEGATIVE,0.9356939792633057
UghHtRaeOOjXjXgCoAEC,3JZ_D3ELwOQ,VOLUME WARNING,NEGATIVE,0.9986847043037415
UggX7Q7YTVBXOngCoAEC,3JZ_D3ELwOQ,"i live in arkansas, there are a lot of meth heads here! most are gettig a crazy check.",NEGATIVE,0.9791154861450195
UgjFJxMLyo-SmHgCoAEC,3JZ_D3ELwOQ,Damn that kangaroo was flexing.,NEGATIVE,0.5457363128662109
Ugh6uyr5p1TkKXgCoAEC,3JZ_D3ELwOQ,Meth &lt;3,POSITIVE,0.9519860744476318
UghSy28a0CysaHgCoAEC,3JZ_D3ELwOQ,Try trimming your beard man,NEGATIVE,0.9893859624862671
UginNBw4nfwXqXgCoAEC,3JZ_D3ELwOQ,Do you even SHAVE bro ?,NEGATIVE,0.9941436648368835
Ugh5ZF9Yb1fP0HgCoAEC,3JZ_D3ELwOQ,Lol you have 666 videos,NEGATIVE,0.9573298096656799
UghrCSxnkCFxnHgCoAEC,3JZ_D3ELwOQ,try running into one of them muscle built mother fuckers at 100km/h,NEGATIVE,0.9961243271827698
UgjTQdxu_vsXmHgCoAEC,3JZ_D3ELwOQ,That kangaroo!! OMG!! ,NEGATIVE,0.8770076632499695
UgiaudGmwUmlJngCoAEC,3JZ_D3ELwOQ,"that dog wasn&#39;t apathetic, he was scared shitless, squirrels are the most vicious predators of nature",NEGATIVE,0.9935160875320435
UghC3JeC51Pzo3gCoAEC,3JZ_D3ELwOQ,Hahahah &quot;stop ma fucker stop!&quot;,NEGATIVE,0.9991334080696106
UghmFh9OSlfMJ3gCoAEC,3JZ_D3ELwOQ,"Ray i fucking love you man, i fucking love you",POSITIVE,0.9995748400688171
Uggk8cG2v8OVFHgCoAEC,3JZ_D3ELwOQ,God I wish =3 would last longer ,NEGATIVE,0.997171938419342
Ugi_b7K85NSRU3gCoAEC,3JZ_D3ELwOQ,Fuckin crack head <br>,NEGATIVE,0.9737213850021362
Ugg7WbdfijEA03gCoAEC,3JZ_D3ELwOQ,Fuckin crack head <br>,NEGATIVE,0.9737213850021362
Ugjg4rwYSoV5Z3gCoAEC,3JZ_D3ELwOQ,so cute :P,POSITIVE,0.9998620748519897
UggbkD6e2DZMEngCoAEC,3JZ_D3ELwOQ,Do u even fuck bro !!! ,NEGATIVE,0.9923959970474243
Ugjp5Gok_njsY3gCoAEC,3JZ_D3ELwOQ,This is the channels 666th video O.O,NEGATIVE,0.9599618911743164
UgilkYzkQYqHuXgCoAEC,3JZ_D3ELwOQ,Is there something wrong with the kangaroo ,NEGATIVE,0.9981169700622559
Ugjy1ffpBlZ7cngCoAEC,3JZ_D3ELwOQ,Kangaroo Jack-ed.... ok ill leave,NEGATIVE,0.9996755123138428
UgjG2erWXxswwHgCoAEC,3JZ_D3ELwOQ,WARRIORS OF VIRTUE,POSITIVE,0.999805748462677
UggO-L9QOzGLv3gCoAEC,3JZ_D3ELwOQ,LMAO! &quot;Do you even fuck bro?&quot;,NEGATIVE,0.9965470433235168
UggbZwwFGhcPzngCoAEC,3JZ_D3ELwOQ,Please don&#39;t take away equals three. :),NEGATIVE,0.9844494462013245
Ugg5W6o__S_x9HgCoAEC,3JZ_D3ELwOQ,Varth Vader is the &quot;Best Boy Electric&quot; what?,NEGATIVE,0.9831411838531494
Ugjk5pTCWYan2XgCoAEC,3JZ_D3ELwOQ,Everyone who thinks that arrest was harsh... My dad used to be on the Missouri highway patrol and he woulda kicked that guys ass before he arrested him,NEGATIVE,0.99528968334198
Ugi773FolmOVH3gCoAEC,3JZ_D3ELwOQ,Ray should&#39;ve said that when the meth head goes to jail the dog isn&#39;t gonna be the only one with &quot;nuts buried in him&quot;.,NEGATIVE,0.9922186136245728
UggZwmEJlkcv93gCoAEC,3JZ_D3ELwOQ,That police is using a glock17,NEGATIVE,0.9760358929634094
UghHYhb2iL3XaHgCoAEC,3JZ_D3ELwOQ,Kangaroo Jacked,NEGATIVE,0.98643559217453
UgiJOiqfDtQ6D3gCoAEC,3JZ_D3ELwOQ,"Kangaroos have two penises, interesting fact hahaha",POSITIVE,0.6316152215003967
UgioJX22kYcBwHgCoAEC,3JZ_D3ELwOQ,"lol &quot;hiding his nuts in the laundry basket.&quot;  <a href=""https://www.youtube.com/watch?v=3JZ_D3ELwOQ&amp;t=119"">1:59</a>",NEGATIVE,0.9985300302505493
Ugg5IBZNXgFza3gCoAEC,3JZ_D3ELwOQ,His 666 video,POSITIVE,0.9467057585716248
Ugj0pmEWuRcqvXgCoAEC,3JZ_D3ELwOQ,"Oh, Arkansas XD we&#39;re just a bunch of meth-heads...",NEGATIVE,0.9960982799530029
UgiNVQUbh0PMzngCoAEC,3JZ_D3ELwOQ,"watching the chase part, then ray said &quot;driving on the wrong side of the road&quot; <br>i had to think about that for a second <br>to me it was the right side ",NEGATIVE,0.993723452091217
Ugi292BZTyQ_bngCoAEC,3JZ_D3ELwOQ,lol thabuff kangaroo made the episode,NEGATIVE,0.9580846428871155
Ugh5nTGe_mHtSHgCoAEC,3JZ_D3ELwOQ,&quot;DONT MOVE!! GET ON THE GROUND!!&quot; so confusing,NEGATIVE,0.9993676543235779
UgjALQo60_O0mXgCoAEC,3JZ_D3ELwOQ,"you should have said &quot;I have nutting to say&quot; at <a href=""https://www.youtube.com/watch?v=3JZ_D3ELwOQ&amp;t=78"">1:18</a>",NEGATIVE,0.9922675490379333
Ugjtjj1raycsLXgCoAEC,3JZ_D3ELwOQ,I want a pet squirrel :(,NEGATIVE,0.9931807518005371
UgiW0aTaNr-hT3gCoAEC,3JZ_D3ELwOQ,HOLY SHIT THE DAMN MUTHA FUCKIN GAME N FISH COMMISION ARKANSAS BABY,NEGATIVE,0.9969682097434998
UgiN0fHhF_pCEHgCoAEC,3JZ_D3ELwOQ,Have you ever smoked a bagpipe?,NEGATIVE,0.9540675282478333
UginL90VWlaJuXgCoAEC,3JZ_D3ELwOQ,love the face hair bro :D,POSITIVE,0.9997859597206116
Ugj3cLMqYbl213gCoAEC,3JZ_D3ELwOQ,only female kangoorus(or what ever way u spell it) have pouches,NEGATIVE,0.9826384782791138
UghjGm9LpgjeVngCoAEC,3JZ_D3ELwOQ,No wonder you&#39;re weird...you&#39;re a cat person...,POSITIVE,0.9242489337921143
UghdRGqvO-v6bHgCoAEC,3JZ_D3ELwOQ,The meth head is also going to have to hide his nuts if you know what I mean?,NEGATIVE,0.9996459484100342
Ugjpd5H4IS9LingCoAEC,3JZ_D3ELwOQ,Do You Even Fuck Bro ?,NEGATIVE,0.9936931133270264
UghDwhpXBsZjxHgCoAEC,3JZ_D3ELwOQ,That was the best cat impression ever XD,POSITIVE,0.9997019171714783
UghUAdCYXigkongCoAEC,3JZ_D3ELwOQ,"I&#39;m Ray William Message, and I approve this Johnson. ",POSITIVE,0.9997710585594177
UgiFLgMlaEYb1HgCoAEC,3JZ_D3ELwOQ,Best ever or at least in a while. ,POSITIVE,0.9995781779289246
UgjDLRrf8PCvYXgCoAEC,3JZ_D3ELwOQ,That kangerroo,NEGATIVE,0.5670398473739624
UgiapFb_OsXRf3gCoAEC,3JZ_D3ELwOQ,Scrat!!!!!,POSITIVE,0.9979223608970642
UghnPmf89iZQwngCoAEC,3JZ_D3ELwOQ,Good ep*,POSITIVE,0.9998645782470703
UginoGPLf_c_6ngCoAEC,3JZ_D3ELwOQ,Hahahah go ep. ,NEGATIVE,0.5393205285072327
Ugin1w3x8MJItXgCoAEC,3JZ_D3ELwOQ,"YAY, ray got his fire back...last episode he acted like he was being forced to make the video, but now he&#39;s awesomely happy again!!!",POSITIVE,0.9993543028831482
Ugj99UjIhIFF_XgCoAEC,3JZ_D3ELwOQ,That third video killed me xDD towards the end!,NEGATIVE,0.9974095225334167
Ugie9VROBDEzl3gCoAEC,3JZ_D3ELwOQ,My bear can own that kangaroo any day son!,POSITIVE,0.9943917393684387
UgjZOkh499Z8SXgCoAEC,3JZ_D3ELwOQ,That squirrel made me rofl so hard,NEGATIVE,0.9890797734260559
Ugh8jCmuZJY8q3gCoAEC,3JZ_D3ELwOQ,ok il spot u,POSITIVE,0.9967902302742004
UgiIev0azBrsBngCoAEC,3JZ_D3ELwOQ,"Video 666, spooky",POSITIVE,0.9810501933097839
Ugj3SWF5l0OoVXgCoAEC,3JZ_D3ELwOQ,"Anyone else see that kangaroo and think, that is Arnold Schwarzenegger if he was a kangaroo? ",NEGATIVE,0.9983019828796387
UgheVcGkCeoRVngCoAEC,3JZ_D3ELwOQ,That cop video was so loud that i could actually hear it with my volume off. No joke,NEGATIVE,0.9930881857872009
Ugg-FhO7Z4i5XXgCoAEC,3JZ_D3ELwOQ,"Ray, go to sir fendora channal he asked for just one like, and look how many he have now...",POSITIVE,0.964991569519043
UghyzgQsrSxOn3gCoAEC,3JZ_D3ELwOQ,HAHAHHAHAHAHAHAHHAH HE TRIES TO COVER HIS NUTS XD,NEGATIVE,0.9992641806602478
UggWHgGLWb_hH3gCoAEC,3JZ_D3ELwOQ,YOU are awesome I&#39;m pretty awesome YOU should check my channel out and sub awesome people UNITE because paperclips!!!,POSITIVE,0.9998273849487305
UggaHcG0ZDUfoHgCoAEC,3JZ_D3ELwOQ,Lol I live in Arkansas ,NEGATIVE,0.5224977135658264
UgjrRDDAvSIrnXgCoAEC,3JZ_D3ELwOQ,Why isn&#39;t this funny anymore?,NEGATIVE,0.9988129138946533
UghrwUHgbRbGdHgCoAEC,3JZ_D3ELwOQ,YOU are awesome I&#39;m pretty awesome YOU should check my channel out and sub awesome people UNITE because paperclips!!!!!,POSITIVE,0.9998193383216858
Ugg7o-czyF_wT3gCoAEC,3JZ_D3ELwOQ,I am kind of glad I live in america so I do not have to deal with kangaroos on steroids.,POSITIVE,0.9913873076438904
UgizipzlKBqWvHgCoAEC,3JZ_D3ELwOQ,it came early,POSITIVE,0.9978609681129456
Ugg0s4UE9sQiiXgCoAEC,3JZ_D3ELwOQ,"<a href=""https://www.youtube.com/watch?v=3JZ_D3ELwOQ&amp;t=106"">1:46</a> - perfect impersonation of Congress. Simply perfect, Ray.",POSITIVE,0.9986618757247925
Ugi5BgkEChCDsXgCoAEC,3JZ_D3ELwOQ,All i could remember was: squirrel aids.. its a thing...,NEGATIVE,0.9980378746986389
Ugi4VQ7dsoX4THgCoAEC,3JZ_D3ELwOQ,... Damn I JUST noticed that you have Ana in your credits under &quot;Fluffer&quot; and Big Rob under &quot;First Associate Chief of Exorcisms&quot; lol,NEGATIVE,0.9528657793998718
UgjE4UpeFikfrngCoAEC,3JZ_D3ELwOQ,I also do hide my nuts in the laundry basket,NEGATIVE,0.9875078797340393
Ugjp_QZaoZwYzXgCoAEC,3JZ_D3ELwOQ,It&#39;s my moms birthday shoutout,POSITIVE,0.9958617687225342
UggXSJJH1rbCpHgCoAEC,3JZ_D3ELwOQ,Shave that pubic hair off ur face dude,NEGATIVE,0.982006847858429
UgglURKVXSH_angCoAEC,3JZ_D3ELwOQ,"<a href=""https://www.youtube.com/watch?v=3JZ_D3ELwOQ&amp;t=23"">0:23</a> Kim Jong Kook Running man!!!!",NEGATIVE,0.8155847191810608
Ugh3KbgXi1TgqHgCoAEC,3JZ_D3ELwOQ,he&#39;s on one. that was hilarious.,POSITIVE,0.9998589754104614
Ugj0_pTwILhwaXgCoAEC,3JZ_D3ELwOQ,Hahaah 4 cats? Pretty sad life 😩,NEGATIVE,0.9918498992919922
UggJfd3XnCXBTXgCoAEC,3JZ_D3ELwOQ,i am the one who knocks ,NEGATIVE,0.7996229529380798
UghKSyJFLx2HZngCoAEC,3JZ_D3ELwOQ,"hmm shave your beard, you look like a homeless guy.!!!",NEGATIVE,0.9984917640686035
UgiZUiAKRl11EHgCoAEC,3JZ_D3ELwOQ,Whahaha that dog he just watched the squirrel like wtf are you doing that isnt gonna work...,NEGATIVE,0.9991737008094788
UgikDFjJ4-wO4ngCoAEC,3JZ_D3ELwOQ,Read the credits you won&#39;t regret it,POSITIVE,0.9960519671440125
UgjnoGv3sy7h6ngCoAEC,3JZ_D3ELwOQ,Podcast are better ,NEGATIVE,0.6539205312728882
Ugj5bZg7cBlXoXgCoAEC,3JZ_D3ELwOQ,please follow me on instagtam hello_bitxch ,NEGATIVE,0.993985116481781
UggutO_eb1New3gCoAEC,3JZ_D3ELwOQ,God I&#39;m going to miss this show,NEGATIVE,0.9993711113929749
Ugj3NNLAgG7OqXgCoAEC,3JZ_D3ELwOQ,Meth is a great preworkout bro. Just a little tho. ,POSITIVE,0.9680193662643433
UgglVsJ2mLwU5XgCoAEC,3JZ_D3ELwOQ,the squirrel was seriously the cutest thing I&#39;ve ever seen. I promise. EVER!,POSITIVE,0.9997913241386414
Ugi9-hhHSeoltHgCoAEC,3JZ_D3ELwOQ,Fuck cat lady...man  fuck I don&#39;t know :/,NEGATIVE,0.9978874325752258
UgjUd91RB1xDJngCoAEC,3JZ_D3ELwOQ,Kangaroo Jack! Get it? Get it? :D,NEGATIVE,0.9962144494056702
UgjLVn4oR0bzSHgCoAEC,3JZ_D3ELwOQ,will Ray ever reveal what message he &#39;&#39;aproves&#39;&#39; at the end of every video??,NEGATIVE,0.993602454662323
Ugj9ew5HkpS0tHgCoAEC,3JZ_D3ELwOQ,Ray do a vine for us :) ,POSITIVE,0.9937670230865479
UggTFQ7V8qcvA3gCoAEC,3JZ_D3ELwOQ,Ray do a vine for us :) ,POSITIVE,0.9937670230865479
UggJ1Pt_BGN9B3gCoAEC,3JZ_D3ELwOQ,"Wow , calling a alien to a kangaroo desiase , fuck You ",NEGATIVE,0.9898262023925781
UggDHN5z7SzrXXgCoAEC,3JZ_D3ELwOQ,That&#39;s the same laundry basket I have!,NEGATIVE,0.9947218894958496
UggCy8m3TlPzgXgCoAEC,3JZ_D3ELwOQ,I like the picture of the legal dianabol instead of some real steroids,NEGATIVE,0.994001567363739
UggfK0FF2jtMXXgCoAEC,3JZ_D3ELwOQ,Video #666,NEGATIVE,0.791444718837738
UghepBKnndl9kngCoAEC,3JZ_D3ELwOQ,hi,POSITIVE,0.9983267188072205
UggXP1yfo47r3HgCoAEC,3JZ_D3ELwOQ,That guys scream after he got out the car,NEGATIVE,0.9932574033737183
UggFYHy3XrV-c3gCoAEC,3JZ_D3ELwOQ,LOL I&#39;ve got the same dog as that it&#39;s called a Bernese mountain dog,NEGATIVE,0.9942499399185181
UghddBpHJv6KbHgCoAEC,3JZ_D3ELwOQ,You spot me bra,POSITIVE,0.998637855052948
Uggg-g9c2sKYY3gCoAEC,3JZ_D3ELwOQ,happy 669th video,POSITIVE,0.9998573064804077
Ughk0rltIhE79XgCoAEC,3JZ_D3ELwOQ,Did you guys here ray fart!?,NEGATIVE,0.9984819293022156
UghaVDt0Uy54rHgCoAEC,3JZ_D3ELwOQ,@alex76767 you are a dumbass ,NEGATIVE,0.9974193572998047
UghhcSJKBWKLcXgCoAEC,3JZ_D3ELwOQ,Lmao this is the first time I actually read the credits at the end,NEGATIVE,0.8937195539474487
Ughl2VWK_mavyXgCoAEC,3JZ_D3ELwOQ,"Darth Vader what :D ? <a href=""https://www.youtube.com/watch?v=3JZ_D3ELwOQ&amp;t=227"">3:47</a>",NEGATIVE,0.9735822081565857
UgjfcgAnZBur7XgCoAEC,3JZ_D3ELwOQ,The police man has a glock 18,NEGATIVE,0.9022723436355591
UgihPSemT8XD_ngCoAEC,3JZ_D3ELwOQ,this episode was hilarious,POSITIVE,0.9998726844787598
Ugg_DuSX5GzhGXgCoAEC,3JZ_D3ELwOQ,"God that was scary, the police chase. When he brought the gun up and aimed out window i thought i was a stun gun. Is it? Or a real gun. And the criminal&#39;s face was so scared and frightened! His eyes! Arrghhh…. that was crazy!",NEGATIVE,0.9938012957572937
